link,text_metadata,text
https://ciudadseva.com/texto/homenaje-a-masoch/,"{'title': 'Homenaje a Masoch', 'metadata': '[Cuento - Texto completo.]', 'author': 'Augusto Monterroso'}","Lo que acostumbraba cuando se acababa de divorciar por primera vez y se encontraba por fin solo y se sentía tan contento de ser libre de nuevo, era, después de estar unas cuantas horas haciendo chistes y carcajeándose con sus amigos en el café, o en el cóctel de la exposición tal, donde todos se morían de risa de las cosas que decía, volver por la noche a su departamento nuevamente de soltero y tranquilamente y con delectación morosa ponerse a acarrear sus instrumentos, primero un sillón, que colocaba en medio del tocadiscos y una mesita, después una botella de ron y un vaso mediano, azul, de vidrio de Carretones, después una grabación de la Tercera Sinfonía de Brahms dirigida por Felix Weingartner, después su gordo ejemplar empastado Editorial Nueva España S.A., México, 1944, de Los hermanos Karamazov; y en seguida conectar el tocadiscos, destapar la botella, servirse un vaso, sentarse y abrir el libro por el capítulo III del Epílogo para leer reiteradamente aquella parte en que se ve muerto al niño Ilucha en un féretro azul, con las manos plegadas sobre el pecho y los ojos cerrados, y en la que el niño Kolya, al saber por Aliocha que Mitya su hermano es inocente de la muerte de su padre y sin embargo va a morir, exclama emocionado que le gustaría morir por toda la humanidad, sacrificarse por la verdad aunque fuese con afrenta; para seguir con las discusiones acerca del lugar en que debía ser enterrado Ilucha, y con las palabras del padre, quien les cuenta que Ilucha le pidió que cuando lo hubiera cubierto la tierra desmigajara un pedazo de pan para que bajaran los gorriones y que él los oiría y se alegraría sintiéndose acompañado, y más tarde él mismo, ya enterrado Ilucha, parte y esparce en pedacitos un pan murmurando: «Venid, volad aquí, pajaritos, volad gorriones», y pierde a cada rato el juicio y se desmaya y se queda como ido y luego vuelve en sí y comienza de nuevo a llorar, y se arrepiente de no haber dado a la madre de Ilucha una flor de su féretro y quiere ir corriendo a ofrecérsela, hasta que por último Aliocha, en un rapto de inspiración, al lado de la gran piedra en donde Ilucha quería ser enterrado, se dirige a los condiscípulos de este y pronuncia el discurso en que les dice aquellas esperanzadas cosas relativas a que pronto se separarán, pero que de todos modos, cualesquiera que sean las circunstancias que tengan que enfrentar en la vida, no deben olvidar ese momento en que se sienten buenos, y que si alguna vez cuando sean mayores se ríen de ellos mismos por haber sido buenos y generosos, una voz dirá en su corazón: «No, no hago bien en reírme, pues no es esto cosa de risa», y que se lo dice por si llegan a ser malos, pero no hay motivo para que seamos malos, verdad muchachos, y que aun dentro de treinta años recordará esos rostros vueltos hacia él, y que a todos los quiere, y que de ahí en adelante todos tendrán un puesto en su corazón, con la final explosión de entusiasmo en que los niños conmovidos gritan a coro ¡viva Karamazov!; lectura que desarrollaba a un ritmo tal y tan bien calculado que los vivas a Karamazov terminaban exactamente con los últimos acordes de la sinfonía, para volver nuevamente a empezar según el efecto del ron lo permitiera, sobre todo que permitiera por último apagar el tocadiscos, tomar una copa final e irse a la cama, para ya en ella hundir minuciosamente la cabeza en la almohada y sollozar y llorar amargamente una vez más por Mitya, por Ilucha, por Aliocha, por Kolya, por Mitya. FIN"
https://ciudadseva.com/texto/humorismo/,"{'title': 'Humorismo', 'metadata': '[Minicuento - Texto completo.]', 'author': 'Augusto Monterroso'}","El humorismo es el realismo llevado a sus últimas consecuencias. Excepto mucha literatura humorística, todo lo que hace el hombre es risible o humorístico.   En las guerras deja de serlo porque durante éstas el hombre deja de serlo. Dijo Eduardo Torres: “El hombre no se conforma con ser el animal más estúpido de la Creación; encima se permite el lujo de ser el único ridículo”. FIN   Movimiento perpetuo, 1972  "
https://ciudadseva.com/texto/imaginacion-y-destino/,"{'title': 'Imaginación y destino', 'metadata': '[Minicuento - Texto completo.]', 'author': 'Augusto Monterroso'}","En la calurosa tarde de verano un hombre descansa acostado, viendo el cielo, bajo un árbol; una manzana cae sobre su cabeza; tiene imaginación, se va a su casa y escribe la Oda a Eva. FIN Lo demás es silencio, 1978"
https://ciudadseva.com/texto/la-fe-y-las-montanas/,"{'title': 'La fe y las montañas', 'metadata': '[Minicuento - Texto completo.]', 'author': 'Augusto Monterroso'}","Al principio la Fe movía montañas sólo cuando era absolutamente necesario, con lo que el paisaje permanecía igual a sí mismo durante milenios. Pero cuando la Fe comenzó a propagarse y a la gente le pareció divertida la idea de mover montañas, éstas no hacían sino cambiar de sitio, y cada vez era más difícil encontrarlas en el lugar en que uno las había dejado la noche anterior; cosa que por supuesto creaba más dificultades que las que resolvía.   La buena gente prefirió entonces abandonar la Fe y ahora las montañas permanecen por lo general en su sitio. Cuando en la carretera se produce un derrumbe bajo el cual mueren varios viajeros, es que alguien, muy lejano o inmediato, tuvo un ligerísimo atisbo de fe. FIN   La oveja negra y demás fábulas, 1969      "
https://ciudadseva.com/texto/la-honda-de-david/,"{'title': 'La honda de David', 'metadata': '[Minicuento - Texto completo.]', 'author': 'Augusto Monterroso'}","Había una vez un niño llamado David N., cuya puntería y habilidad en el manejo de la resortera despertaba tanta envidia y admiración en sus amigos de la vecindad y de la escuela, que veían en él -y así lo comentaban entre ellos cuando sus padres no podían escucharlos- un nuevo David. Pasó el tiempo Cansado del tedioso tiro al blanco que practicaba disparando sus guijarros contra latas vacías o pedazos de botella, David descubrió que era mucho más divertido ejercer contra los pájaros la habilidad con que Dios lo había dotado, de modo que de ahí en adelante la emprendió con todos los que se ponían a su alcance, en especial contra Pardillos, Alondras, Ruiseñores y Jilgueros, cuyos cuerpecitos sangrantes caían suavemente sobre la hierba, con el corazón agitado aún por el susto y la violencia de la pedrada. David corría jubiloso hacia ellos y los enterraba cristianamente. Cuando los padres de David se enteraron de esta costumbre de su buen hijo se alarmaron mucho, le dijeron que qué era aquello, y afearon su conducta en términos tan ásperos y convincentes que, con lágrimas en los ojos, él reconoció su culpa, se arrepintió sincero y durante mucho tiempo se aplicó a disparar exclusivamente sobre los otros niños. Dedicado años después a la milicia, en la Segunda Guerra Mundial David fue ascendido a general y condecorado con las cruces más altas por matar él solo a treinta y seis hombres, y más tarde degradado y fusilado por dejar escapar con vida una Paloma mensajera del enemigo. FIN"
https://ciudadseva.com/texto/la-jirafa-que-de-pronto-comprendio-que-todo-es-relativo/,"{'title': 'La jirafa que de pronto comprendió que todo es relativo', 'metadata': '[Cuento - Texto completo.]', 'author': 'Augusto Monterroso'}","Hace mucho tiempo, en un país lejano, vivía una Jirafa de estatura regular pero tan descuidada que una vez se salió de la selva y se perdió. Desorientada como siempre, se puso a caminar a tontas y a locas de aquí para allá, y por más que se agachaba para encontrar el camino no lo encontraba. Así, deambulando, llegó a un desfiladero donde en ese momento tenía lugar una gran batalla. A pesar de que las bajas eran cuantiosas por ambos bandos, ninguno estaba dispuesto a ceder un milímetro de terreno. Los generales arengaban a sus tropas con las espadas en alto, al mismo tiempo que la nieve se teñía de púrpura con la sangre de los heridos. Entre el humo y el estrépito de los cañones se veía desplomarse a los muertos de uno y otro ejército, con tiempo apenas para encomendar su alma al diablo; pero los sobrevivientes continuaban disparando con entusiasmo hasta que a ellos también les tocaba y caían con un gesto estúpido pero que en su caída consideraban que la Historia iba a recoger como heroico, pues morían por defender su bandera; y efectivamente la Historia recogía esos gestos como heroicos, tanto la Historia que recogía los gestos del uno, como la que recogía los gestos del otro, ya que cada lado escribía su propia Historia; así, Wellington era un héroe para los ingleses y Napoleón era un héroe para los franceses. A todo esto, la Jirafa siguió caminando, hasta que llegó a una parte del desfiladero en que estaba montado un enorme cañón, que en ese preciso instante hizo un disparo exactamente unos veinte centímetros arriba de su cabeza, más o menos. Al ver pasar la bala tan cerca, y mientras seguía con la vista su trayectoria, la Jirafa pensó: “Qué bueno que no soy tan alta, pues si mi cuello midiera treinta centímetros más esa bala me hubiera volado la cabeza; o bien, qué bueno que esta parte del desfiladero en que está el cañón no es tan baja, pues si midiera treinta centímetros menos la bala también me hubiera volado la cabeza. Ahora comprendo que todo es relativo.” FIN"
https://ciudadseva.com/texto/la-mosca-que-sonaba-que-era-un-aguila/,"{'title': 'La mosca que soñaba que era un águila', 'metadata': '[Minicuento - Texto completo.]', 'author': 'Augusto Monterroso'}","Había una vez una Mosca que todas las noches soñaba que era un Águila y que se encontraba volando por los Alpes y por los Andes. En los primeros momentos esto la volvía loca de felicidad; pero pasado un tiempo le causaba una sensación de angustia, pues hallaba las alas demasiado grandes, el cuerpo demasiado pesado, el pico demasiado duro y las garras demasiado fuertes; bueno, que todo ese gran aparato le impedía posarse a gusto sobre los ricos pasteles o sobre las inmundicias humanas, así como sufrir a conciencia dándose topes contra los vidrios de su cuarto. En realidad no quería andar en las grandes alturas o en los espacios libres, ni mucho menos. Pero cuando volvía en sí lamentaba con toda el alma no ser un Águila para remontar montañas, y se sentía tristísima de ser una Mosca, y por eso volaba tanto, y estaba tan inquieta, y daba tantas vueltas, hasta que lentamente, por la noche, volvía a poner las sienes en la almohada. FIN"
https://ciudadseva.com/texto/la-oveja-negra/,"{'title': 'La oveja negra', 'metadata': '[Minicuento - Texto completo.]', 'author': 'Augusto Monterroso'}","En un lejano país existió hace muchos años una Oveja negra. Fue fusilada. Un siglo después, el rebaño arrepentido le levantó una estatua ecuestre que quedó muy bien en el parque. Así, en lo sucesivo, cada vez que aparecían ovejas negras eran rápidamente pasadas por las armas para que las futuras generaciones de ovejas comunes y corrientes pudieran ejercitarse también en la escultura.   FIN"
https://ciudadseva.com/texto/la-rana-que-queria-ser-una-rana-autentica/,"{'title': 'La rana que quería ser una rana auténtica', 'metadata': '[Minicuento - Texto completo.]', 'author': 'Augusto Monterroso'}","Había una vez una rana que quería ser una rana auténtica, y todos los días se esforzaba en ello. Al principio se compró un espejo en el que se miraba largamente buscando su ansiada autenticidad. Unas veces parecía encontrarla y otras no, según el humor de ese día o de la hora, hasta que se cansó de esto y guardó el espejo en un baúl. Por fin pensó que la única forma de conocer su propio valor estaba en la opinión de la gente, y comenzó a peinarse y a vestirse y a desvestirse (cuando no le quedaba otro recurso) para saber si los demás la aprobaban y reconocían que era una rana auténtica. Un día observó que lo que más admiraban de ella era su cuerpo, especialmente sus piernas, de manera que se dedicó a hacer sentadillas y a saltar para tener unas ancas cada vez mejores, y sentía que todos la aplaudían. Y así seguía haciendo esfuerzos hasta que, dispuesta a cualquier cosa para lograr que la consideraran una rana auténtica, se dejaba arrancar las ancas, y los otros se las comían, y ella todavía alcanzaba a oír con amargura cuando decían que qué buena rana, que parecía pollo. FIN"
https://ciudadseva.com/texto/la-sirena-inconforme/,"{'title': 'La sirena inconforme', 'metadata': '[Minicuento - Texto completo.]', 'author': 'Augusto Monterroso'}","Usó todas sus voces, todos sus registros; en cierta forma se extralimitó; quedó afónica quién sabe por cuánto tiempo. Las otras pronto se dieron cuenta de que era poco lo que podían hacer, de que el aburridor y astuto Ulises había empleado una vez más su ingenio, y con cierto alivio se resignaron a dejarlo pasar. Ésta no; ésta luchó hasta el fin, incluso después de que aquel hombre tan amado y deseado desapareció definitivamente. Pero el tiempo es terco y pasa y todo vuelve. Al regreso del héroe, cuando sus compañeras, aleccionadas por la experiencia, ni siquiera tratan de repetir sus vanas insinuaciones, sumisa, con la voz apagada, y persuadida de la inutilidad de su intento, sigue cantando. Por su parte, más seguro de sí mismo, como quien había viajado tanto, esta vez Ulises se detuvo, desembarcó, le estrechó la mano, escuchó el canto solitario durante un tiempo según él más o menos discreto, y cuando lo consideró oportuno la poseyó ingeniosamente; poco después, de acuerdo con su costumbre, huyó. De esta unión nació el fabuloso Hygrós, o sea “el Húmedo” en nuestro seco español, posteriormente proclamado patrón de las vírgenes solitarias, las pálidas prostitutas que las compañías navieras contratan para entretener a los pasajeros tímidos que en las noches deambulan por las cubiertas de sus vastos trasatlánticos, los pobres, los ricos, y otras causas perdidas. FIN 1969"
https://ciudadseva.com/texto/la-tela-de-penelope-o-quien-engana-a-quien/,"{'title': 'La tela de Penélope o quién engaña a quién', 'metadata': '[Minicuento - Texto completo.]', 'author': 'Augusto Monterroso'}","Hace muchos años vivía en Grecia un hombre llamado Ulises (quien a pesar de ser bastante sabio era muy astuto), casado con Penélope, mujer bella y singularmente dotada cuyo único defecto era su desmedida afición a tejer, costumbre gracias a la cual pudo pasar sola largas temporadas. Dice la leyenda que en cada ocasión en que Ulises con su astucia observaba que a pesar de sus prohibiciones ella se disponía una vez más a iniciar uno de sus interminables tejidos, se le podía ver por las noches preparando a hurtadillas sus botas y una buena barca, hasta que sin decirle nada se iba a recorrer el mundo y a buscarse a sí mismo. De esta manera ella conseguía mantenerlo alejado mientras coqueteaba con sus pretendientes, haciéndoles creer que tejía mientras Ulises viajaba y no que Ulises viajaba mientras ella tejía, como pudo haber imaginado Homero, que, como se sabe, a veces dormía y no se daba cuenta de nada. FIN"
https://ciudadseva.com/texto/la-tortuga-y-aquiles/,"{'title': 'La tortuga y Aquiles', 'metadata': '[Minicuento - Texto completo.]', 'author': 'Augusto Monterroso'}","Por fin, según el cable, la semana pasada la tortuga llegó a la meta. En rueda de prensa declaró modestamente que siempre temió perder, pues su contrincante le pisó todo el tiempo los talones. En efecto, una diezmiltrillonésima de segundo después, como una flecha y maldiciendo a Zenón de Elea, llegó Aquiles. FIN"
https://ciudadseva.com/texto/la-vida-en-comun/,"{'title': 'La vida en común', 'metadata': '[Minicuento - Texto completo.]', 'author': 'Augusto Monterroso'}","Alguien que a toda hora se queja con amargura de tener que soportar su cruz (esposo, esposa, padre, madre, abuelo, abuela, tío, tía, hermano, hermana, hijo, hija, padrastro, madrastra, hijastro, hijastra, suegro, suegra, yerno, nuera) es a la vez la cruz del otro, que amargamente se queja de tener que sobrellevar a toda hora la cruz (nuera, yerno, suegra, suegro, hijastra, hijastro, madrastra, padrastro, hija, hijo, hermana, hermano, tía, tío, abuela, abuelo, madre, padre, esposa, esposo) que le ha tocado cargar en esta vida, y así, de cada quien según su capacidad y a cada quien según sus necesidades. FIN"
https://ciudadseva.com/texto/las-criadas/,"{'title': 'Las criadas', 'metadata': '[Minicuento - Texto completo.]', 'author': 'Augusto Monterroso'}","Amo a las sirvientas por irreales, porque se van, porque no les gusta obedecer, porque encarnan los últimos vestigios del trabajo libre y la contratación voluntaria y no tienen seguro ni prestaciones ni; porque como fantasmas de una raza extinguida llegan, se meten a las casas, husmean, escarban, se asoman a los abismos de nuestros mezquinos secretos leyendo en los restos de las tazas de café o de las copas de vino, en las colillas, o sencillamente introduciendo sus miradas furtivas y sus ávidas manos en los armarios, debajo de las almohadas, o recogiendo los pedacitos de los papeles rotos y el eco de nuestros pleitos, en tanto sacuden y barren nuestras porfiadas miserias y las sobras de nuestros odios cuando se quedan solas toda la mañana cantando triunfalmente; porque son recibidas como anunciaciones en el momento en que aparecen con su caja de Nescafé o de Kellog’s llena de ropa y de peines y de mínimos espejos cubiertos todavía con el polvo de la última irrealidad en que se movieron; porque entonces a todo dicen que sí y parece que ya nunca nos faltará su mano protectora; porque finalmente deciden marcharse como vinieron pero con un conocimiento más profundo de los seres humanos, de la comprensión y la solidaridad; porque son los últimos representantes del Mal y porque nuestras señoras no saben qué hacer sin el Mal y se aferran a él, le ruegan que por favor no abandone esta tierra; porque son los únicos seres que nos vengan de los agravios de esas mismas señoras yéndose simplemente, recogiendo otra vez sus ropas de colores, sus cosas, sus frascos de crema de tercera clase ocupados ahora con crema de primera clase ahora un poquito sucia, fruto de sus inhábiles hurtos. Me voy, le dicen vigorosamente llenando una vez más sus cajas de cartón. Pero por qué. Porque sí (¡oh libertad inefable!) Y allá van, ángeles malignos, en busca de nuevas aventuras, de una nueva casa, de un nuevo catre, de un nuevo lavadero, de una nueva señora que no pueda vivir sin ellas y las ame; planeado una nueva vida, negándose al agradecimiento por lo bien que las trataron cuando se enfermaron y les dieron amorosamente su aspirina por temor a que al otro día no pudieran lavar los platos, que es lo que en verdad cansa, hacer la comida no cansa. Amo verlas llegar, llamar, sonreír, entrar, decir que sí; pero no, siempre resistiéndose a encontrar a su Mary Poppins-Señora que les resuelva todos los problemas, los de sus papás, los de sus hermanos menores y mayores, entre los cuales uno las violó en su oportunidad; que por las noches les enseñe en la cama a cantar do-re-mi, do-re-mi hasta que se queden dormidas con el pensamiento puesto dulcemente en los platos de mañana sumergidos en una nueva ola de espuma de detergente fab-sol-la-si, y les acaricie con ternura el cabello y se aleje sin hacer ruido, de puntillas, y apague la luz en el último momento antes de abandonar la recámara de contornos vagamente irreales. FIN"
