link,text_metadata,text
https://ciudadseva.com/texto/mister-taylor/,"{'title': 'Míster Taylor', 'metadata': '[Cuento - Texto completo.]', 'author': 'Augusto Monterroso'}","-Menos rara, aunque sin duda más ejemplar -dijo entonces el otro-, es la historia de Mr. Percy Taylor, cazador de cabezas en la selva amazónica. Se sabe que en 1937 salió de Boston, Massachusetts, en donde había pulido su espíritu hasta el extremo de no tener un centavo. En 1944 aparece por primera vez en América del Sur, en la región del Amazonas, conviviendo con los indígenas de una tribu cuyo nombre no hace falta recordar. Por sus ojeras y su aspecto famélico pronto llegó a ser conocido allí como “el gringo pobre”, y los niños de la escuela hasta lo señalaban con el dedo y le tiraban piedras cuando pasaba con su barba brillante bajo el dorado sol tropical. Pero esto no afligía la humilde condición de Mr. Taylor porque había leído en el primer tomo de las Obras Completas de William G. Knight que si no se siente envidia de los ricos la pobreza no deshonra. En pocas semanas los naturales se acostumbraron a él y a su ropa extravagante. Además, como tenía los ojos azules y un vago acento extranjero, el Presidente y el Ministro de Relaciones Exteriores lo trataban con singular respeto, temerosos de provocar incidentes internacionales. Tan pobre y mísero estaba, que cierto día se internó en la selva en busca de hierbas para alimentarse. Había caminado cosa de varios metros sin atreverse a volver el rostro, cuando por pura casualidad vio a través de la maleza dos ojos indígenas que lo observaban decididamente. Un largo estremecimiento recorrió la sensitiva espalda de Mr. Taylor. Pero Mr. Taylor, intrépido, arrostró el peligro y siguió su camino silbando como si nada hubiera pasado. De un salto (que no hay para qué llamar felino) el nativo se le puso enfrente y exclamó: –Buy head? Money, money. A pesar de que el inglés no podía ser peor, Mr. Taylor, algo indispuesto, sacó en claro que el indígena le ofrecía en venta una cabeza de hombre, curiosamente reducida, que traía en la mano. Es innecesario decir que Mr. Taylor no estaba en capacidad de comprarla; pero como aparentó no comprender, el indio se sintió terriblemente disminuido por no hablar bien el inglés, y se la regaló pidiéndole disculpas. Grande fue el regocijo con que Mr. Taylor regresó a su choza. Esa noche, acostado boca arriba sobre la precaria estera de palma que le servía de lecho, interrumpido tan solo por el zumbar de las moscas acaloradas que revoloteaban en torno haciéndose obscenamente el amor, Mr. Taylor contempló con deleite durante un buen rato su curiosa adquisición. El mayor goce estético lo extraía de contar, uno por uno, los pelos de la barba y el bigote, y de ver de frente el par de ojillos entre irónicos que parecían sonreírle agradecidos por aquella deferencia. Hombre de vasta cultura, Mr. Taylor solía entregarse a la contemplación; pero esta vez en seguida se aburrió de sus reflexiones filosóficas y dispuso obsequiar la cabeza a un tío suyo, Mr. Rolston, residente en Nueva York, quien desde la más tierna infancia había revelado una fuerte inclinación por las manifestaciones culturales de los pueblos hispanoamericanos. Pocos días después el tío de Mr. Taylor le pidió -previa indagación sobre el estado de su importante salud- que por favor lo complaciera con cinco más. Mr. Taylor accedió gustoso al capricho de Mr. Rolston y -no se sabe de qué modo- a vuelta de correo “tenía mucho agrado en satisfacer sus deseos”. Muy reconocido, Mr. Rolston le solicitó otras diez. Mr. Taylor se sintió “halagadísimo de poder servirlo”. Pero cuando pasado un mes aquél le rogó el envío de veinte, Mr. Taylor, hombre rudo y barbado pero de refinada sensibilidad artística, tuvo el presentimiento de que el hermano de su madre estaba haciendo negocio con ellas. Bueno, si lo quieren saber, así era. Con toda franqueza, Mr. Rolston se lo dio a entender en una inspirada carta cuyos términos resueltamente comerciales hicieron vibrar como nunca las cuerdas del sensible espíritu de Mr. Taylor. De inmediato concertaron una sociedad en la que Mr. Taylor se comprometía a obtener y remitir cabezas humanas reducidas en escala industrial, en tanto que Mr. Rolston las vendería lo mejor que pudiera en su país. Los primeros días hubo algunas molestas dificultades con ciertos tipos del lugar. Pero Mr. Taylor, que en Boston había logrado las mejores notas con un ensayo sobre Joseph Henry Silliman, se reveló como político y obtuvo de las autoridades no sólo el permiso necesario para exportar, sino, además, una concesión exclusiva por noventa y nueve años. Escaso trabajo le costó convencer al guerrero Ejecutivo y a los brujos Legislativos de que aquel paso patriótico enriquecería en corto tiempo a la comunidad, y de que luego luego estarían todos los sedientos aborígenes en posibilidad de beber (cada vez que hicieran una pausa en la recolección de cabezas) de beber un refresco bien frío, cuya fórmula mágica él mismo proporcionaría. Cuando los miembros de la Cámara, después de un breve pero luminoso esfuerzo intelectual, se dieron cuenta de tales ventajas, sintieron hervir su amor a la patria y en tres días promulgaron un decreto exigiendo al pueblo que acelerara la producción de cabezas reducidas. Contados meses más tarde, en el país de Mr. Taylor las cabezas alcanzaron aquella popularidad que todos recordamos. Al principio eran privilegio de las familias más pudientes; pero la democracia es la democracia y, nadie lo va a negar, en cuestión de semanas pudieron adquirirlas hasta los mismos maestros de escuela. Un hogar sin su correspondiente cabeza teníase por un hogar fracasado. Pronto vinieron los coleccionistas y, con ellos, las contradicciones: poseer diecisiete cabezas llegó a ser considerado de mal gusto; pero era distinguido tener once. Se vulgarizaron tanto que los verdaderos elegantes fueron perdiendo interés y ya sólo por excepción adquirían alguna, si presentaba cualquier particularidad que la salvara de lo vulgar. Una, muy rara, con bigotes prusianos, que perteneciera en vida a un general bastante condecorado, fue obsequiada al Instituto Danfeller, el que a su vez donó, como de rayo, tres y medio millones de dólares para impulsar el desenvolvimiento de aquella manifestación cultural, tan excitante, de los pueblos hispanoamericanos. Mientras tanto, la tribu había progresado en tal forma que ya contaba con una veredita alrededor del Palacio Legislativo. Por esa alegre veredita paseaban los domingos y el Día de la Independencia los miembros del Congreso, carraspeando, luciendo sus plumas, muy serios, riéndose, en las bicicletas que les había obsequiado la Compañía. Pero, ¿que quieren? No todos los tiempos son buenos. Cuando menos lo esperaban se presentó la primera escasez de cabezas. Entonces comenzó lo más alegre de la fiesta. Las meras defunciones resultaron ya insuficientes. El Ministro de Salud Pública se sintió sincero, y una noche caliginosa, con la luz apagada, después de acariciarle un ratito el pecho como por no dejar, le confesó a su mujer que se consideraba incapaz de elevar la mortalidad a un nivel grato a los intereses de la Compañía, a lo que ella le contestó que no se preocupara, que ya vería cómo todo iba a salir bien, y que mejor se durmieran. Para compensar esa deficiencia administrativa fue indispensable tomar medidas heroicas y se estableció la pena de muerte en forma rigurosa. Los juristas se consultaron unos a otros y elevaron a la categoría de delito, penado con la horca o el fusilamiento, según su gravedad, hasta la falta más nimia. Incluso las simples equivocaciones pasaron a ser hechos delictuosos. Ejemplo: si en una conversación banal, alguien, por puro descuido, decía “Hace mucho calor”, y posteriormente podía comprobársele, termómetro en mano, que en realidad el calor no era para tanto, se le cobraba un pequeño impuesto y era pasado ahí mismo por las armas, correspondiendo la cabeza a la Compañía y, justo es decirlo, el tronco y las extremidades a los dolientes. La legislación sobre las enfermedades ganó inmediata resonancia y fue muy comentada por el Cuerpo Diplomático y por las Cancillerías de potencias amigas. De acuerdo con esa memorable legislación, a los enfermos graves se les concedían veinticuatro horas para poner en orden sus papeles y morirse; pero si en este tiempo tenían suerte y lograban contagiar a la familia, obtenían tantos plazos de un mes como parientes fueran contaminados. Las víctimas de enfermedades leves y los simplemente indispuestos merecían el desprecio de la patria y, en la calle, cualquiera podía escupirle el rostro. Por primera vez en la historia fue reconocida la importancia de los médicos (hubo varios candidatos al premio Nóbel) que no curaban a nadie. Fallecer se convirtió en ejemplo del más exaltado patriotismo, no sólo en el orden nacional, sino en el más glorioso, en el continental. Con el empuje que alcanzaron otras industrias subsidiarias (la de ataúdes, en primer término, que floreció con la asistencia técnica de la Compañía) el país entró, como se dice, en un periodo de gran auge económico. Este impulso fue particularmente comprobable en una nueva veredita florida, por la que paseaban, envueltas en la melancolía de las doradas tardes de otoño, las señoras de los diputados, cuyas lindas cabecitas decían que sí, que sí, que todo estaba bien, cuando algún periodista solícito, desde el otro lado, las saludaba sonriente sacándose el sombrero. Al margen recordaré que uno de estos periodistas, quien en cierta ocasión emitió un lluvioso estornudo que no pudo justificar, fue acusado de extremista y llevado al paredón de fusilamiento. Sólo después de su abnegado fin los académicos de la lengua reconocieron que ese periodista era una de las más grandes cabezas del país; pero una vez reducida quedó tan bien que ni siquiera se notaba la diferencia. ¿Y Mr. Taylor? Para ese tiempo ya había sido designado consejero particular del Presidente Constitucional. Ahora, y como ejemplo de lo que puede el esfuerzo individual, contaba los miles por miles; mas esto no le quitaba el sueño porque había leído en el último tomo de las Obras completas de William G. Knight que ser millonario no deshonra si no se desprecia a los pobres. Creo que con ésta será la segunda vez que diga que no todos los tiempos son buenos. Dada la prosperidad del negocio llegó un momento en que del vecindario sólo iban quedando ya las autoridades y sus señoras y los periodistas y sus señoras. Sin mucho esfuerzo, el cerebro de Mr. Taylor discurrió que el único remedio posible era fomentar la guerra con las tribus vecinas. ¿Por qué no? El progreso. Con la ayuda de unos cañoncitos, la primera tribu fue limpiamente descabezada en escasos tres meses. Mr. Taylor saboreó la gloria de extender sus dominios. Luego vino la segunda; después la tercera y la cuarta y la quinta. El progreso se extendió con tanta rapidez que llegó la hora en que, por más esfuerzos que realizaron los técnicos, no fue posible encontrar tribus vecinas a quienes hacer la guerra. Fue el principio del fin. Las vereditas empezaron a languidecer. Sólo de vez en cuando se veía transitar por ellas a alguna señora, a algún poeta laureado con su libro bajo el brazo. La maleza, de nuevo, se apoderó de las dos, haciendo difícil y espinoso el delicado paso de las damas. Con las cabezas, escasearon las bicicletas y casi desaparecieron del todo los alegres saludos optimistas. El fabricante de ataúdes estaba más triste y fúnebre que nunca. Y todos sentían como si acabaran de recordar de un grato sueño, de ese sueño formidable en que tú te encuentras una bolsa repleta de monedas de oro y la pones debajo de la almohada y sigues durmiendo y al día siguiente muy temprano, al despertar, la buscas y te hallas con el vacío. Sin embargo, penosamente, el negocio seguía sosteniéndose. Pero ya se dormía con dificultad, por el temor a amanecer exportado. En la patria de Mr. Taylor, por supuesto, la demanda era cada vez mayor. Diariamente aparecían nuevos inventos, pero en el fondo nadie creía en ellos y todos exigían las cabecitas hispanoamericanas.   Fue para la última crisis. Mr. Rolston, desesperado, pedía y pedía más cabezas. A pesar de que las acciones de la Compañía sufrieron un brusco descenso, Mr. Rolston estaba convencido de que su sobrino haría algo que lo sacara de aquella situación. Los embarques, antes diarios, disminuyeron a uno por mes, ya con cualquier cosa, con cabezas de niño, de señoras, de diputados. De repente cesaron del todo. Un viernes áspero y gris, de vuelta de la Bolsa, aturdido aún por la gritería y por el lamentable espectáculo de pánico que daban sus amigos, Mr. Rolston se decidió a saltar por la ventana (en vez de usar el revólver, cuyo ruido lo hubiera llenado de terror) cuando al abrir un paquete del correo se encontró con la cabecita de Mr. Taylor, que le sonreía desde lejos, desde el fiero Amazonas, con una sonrisa falsa de niño que parecía decir: “Perdón, perdón, no lo vuelvo a hacer.” FIN"
https://ciudadseva.com/texto/nube/,"{'title': 'Nube', 'metadata': '[Minicuento - Texto completo.]', 'author': 'Augusto Monterroso'}","La nube de verano es pasajera, así como las grandes pasiones son nubes de verano, o de invierno, según el caso.   FIN   Lo demás es silencio, 1978      "
https://ciudadseva.com/texto/nulla-dies-sine-linea/,"{'title': '“Nulla dies sine linea”', 'metadata': '[Minicuento - Texto completo.]', 'author': 'Augusto Monterroso'}",-Envejezco mal -dijo; y se murió. FIN
https://ciudadseva.com/texto/obras-completas/,"{'title': 'Obras completas', 'metadata': '[Cuento - Texto completo.]', 'author': 'Augusto Monterroso'}","Cuando cumplió cincuenta y cinco años, el profesor Fombona había consagrado cuarenta al resignado estudio de las más diversas literaturas, y los mejores círculos intelectuales lo consideraban autoridad de primer orden en una dilatada variedad de autores. Sus traducciones, monografías, prólogos y conferencias, sin ser lo que se llama geniales (por lo menos eso dicen hasta sus enemigos) podrían constituir en caso dado una preciosa memoria de cuanto valor se ha escrito en el mundo, máxime si ese caso fuera, digamos, la destrucción de todas las bibliotecas existentes. Su gloria como maestro de la juventud no era menor. El selecto grupo de ávidos discípulos que comandaba, y con el que compartía una que otra hora por las tardes, veía en él un humanista de inagotable erudición y seguía sus indicaciones con fanatismo incondicional, del que el propio Fombona era el primero en asustarse: más de una vez había sentido el peso de esos destinos gravitando sobre su conciencia. El último, Feijoo, apareció tímidamente. Un día. Con cualquier pretexto, se atrevió a reunírseles en el café*. Aceptado en principio por Fombona, más tarde se incorporó al grupo como todo buen neófito: con cierto temor inocultable y sin participar mucho en las discusiones. Sin embargo, pasados algunos días y vencida en parte la timidez inicial, se decidió al fin a mostrarles algunos versos. Le gustaba leerlos él mismo, acentuando con entonación molestamente escolar las partes que creía de mayor efecto. Después doblaba sus papelitos con serenidad nerviosa, los metía en su cartapacio y jamás volvía a hablar de ellos. Ante cualquier opinión, favorable o negativa, desarrollaba un silencio oprimido, molesto. Inútil consignar que a Fombona esos trabajos no le parecían buenos, pero adivinaba en el autor cierta fuerza poética oculta pugnando por salir. La inseguridad de Feijoo no podía escapar a la felina percepción de Fombona. Muchas veces lo pensó con detenimiento y estuvo a punto de decirle unas palabras de elogio (era obvio que Feijoo las necesitaba); pero una resistencia extraña que no llegó nunca a comprender, o que trataba por todos los medios de ocultarse, le impedía pronunciar esas palabras. Por el contrario, si algo se le ocurría era más bien una broma, cualquier agudeza sobre los versos, que provocaba invariablemente la risa de todos. Decía que eso «descargaba la atmósfera» haciendo menos sensible su presencia de maestro; pero un acre remordimiento se apoderaba siempre de él inmediatamente después de aquellas salidas. La parquedad en el elogio era la virtud que cultivaba con más esmero. Sin duda porque él mismo, a la edad de Feijoo, se avergonzaba de escribir versos, y un rubor invencible -tanto más difícil de evitar cuanto más combatido- le subía al rostro si alguien encomiaba sus vacilantes composiciones. Aún ahora, cuando cuarenta años de tenaz ejercicio literario -traducciones, monografías, prólogos y conferencias- le deparaban una seguridad antes desconocida, rehuía todo género de alabanzas, y los elogios de sus admiradores eran para él más bien una constante amenaza, algo que en secreto imploraba, pero que rechazaba siempre con un gesto huraño, o superior. Con el tiempo los poemas de Feijoo empezaron a ser perceptiblemente mejores. Claro, ni Fombona ni su grupo se lo decían, pero en ausencia de Feijoo comentaban la posibilidad de que terminara por convertirse en un gran poeta. Sus progresos fueron finalmente tan notorios que el mismo Fombona se entusiasmó, y una tarde, como sin darse cuenta, le dijo que a pesar de todo sus versos encerraban no poca belleza. El rubor de Feijoo ante lo insólito de ese inesperado incienso fue más visible y penoso que nunca. Evidentemente sufría por la exigencia futura que esas palabras implicaban: mientras Fombona guardó silencio no tenía nada que perder; ahora su obligación era superarse a cada nuevo intento para conservar el derecho a aquella generosa frase de aliento. Desde entonces le fue cada vez más difícil mostrar sus trabajos. Por otra parte, a partir de ese momento el entusiasmo de Fombona se transformó en una discreta indiferencia que Feijoo no tuvo la capacidad de comprender. Un sentimiento de impotencia lo asaltó ya no solo ante los demás, sino hasta a solas consigo mismo. Aquella alabanza de Fombona equivalía un poco a la gloria, y el riesgo de una censura fue algo que Feijoo no se sintió ya con fuerzas para afrontar. Pertenecía a esa clase de personas a quienes los elogios hacen daño. En Daysie’s el café no es muy bueno y últimamente lo contamina la televisión. Saltemos sobre la ingrata descripción de ese ambiente banal y no nos detengamos, pues no viene al caso, ni siquiera a ver los rostros llenos de vida de las adolescentes que pueblan las mesas, ni mucho menos a oír las conversaciones de los graves empleados de banco que en las tardes, a la hora del crepúsculo, gustan dialogar, llenos de la suave melancolía propia de su profesión, acerca de sus números y de las mujeres sutilmente perfumadas con que sueñan. Iturbe, Ríos y Montúfar charlaban sobre sus respectivas especialidades: Montúfar, Quintiliano; Ríos, Lope de Vega; Iturbe, Rodó. Al calor de un café que la charla había dejado enfriar, Fombona, como un director de orquesta, señalaba a cada uno la nota apropiada, y extraía una y otra vez de su insondable saco gris (cruelmente injuriado por superpuestas manchas de origen poco misterioso) tarjetas con nuevos datos, por las cuales la posteridad estaría en aptitud de saber que hubo una coma que Rodó no puso, un verso que Lope encontró prácticamente en la calle, un giro que indignaba a Quintiliano. Brillaba en todos los ojos la alegría que esos aportes eruditos despiertan siempre en las personas de corazón sensible. Cartas de primordiales especialistas, envíos de amigos lejanos y hasta contribuciones de procedencia anónima, iban a acrecentar semana a semana el conocimiento exhaustivo de esos grandes hombres distantes en el tiempo y en la geografía. Esta variante, aquella simple errata descubierta en los textos, acrecentaban en el grupo la fe en la importancia de su trabajo, en la cultura, en el destino de la humanidad. Feijoo, según su costumbre, llegó en silencio y se colocó de inmediato al margen de la conversación. Aparte de conocer bien a Lope de Vega (aunque conocer «bien» a Lope de Vega era algo que Fombona no creía posible), es improbable que supiera distinguir con claridad la diferencia precisa entre Quintiliano y Rodó. Resultaba fácil ver que se sentía molesto y como disminuido. Fombona consideró propicio el momento. Como solía en esos casos, produjo un cargado silencio que se prolongó por varios minutos. Después, sonriendo un poco, dijo: -Dígame, Feijoo, ¿recuerda aquella cita de Shakespeare que trae Unamuno en el capítulo III de Del sentimiento trágico de la vida? No; Feijoo no la recordaba. -Búsquela; es interesante, puede servirle. Tal como lo esperaba, al día siguiente Feijoo habló de aquella cita y de su torpe memoria. Unamuno dejó de ser tema de conversación por algunos días. Y Quintiliano, Lope y Rodó tuvieron tiempo de crecer considerablemente. Cuando ya Unamuno estaba olvidado por completo: -Feijoo -dijo otra vez sonriendo Fombona-, usted que conoce tan bien a Unamuno, ¿recuerda cuál fue su primer libro traducido al francés? Feijoo no lo recordaba muy bien. El sábado y el domingo siguiente no se vieron. Pero el lunes Feijoo proporcionó ese dato, y la fecha, y el pie de imprenta. Desde ese día inolvidable las conversaciones adquirieron un nuevo huésped efectivo: Feijoo. Ahora charlaban mucho mejor, y cierto atardecer desapacible, en que la lluvia imprimía una vaga tristeza en los rostros de todos, Feijoo pronunció por primera vez, clara y distintamente, el nombre sagrado de Quintiliano. Feijoo, antigua pieza suelta en aquel armonioso sistema, había encontrado por fin su lugar preciso en el engranaje. Desde entonces los unió algo que antes no compartían: el afán de saber, de saber con precisión. Fombona volvió a gozar el deleite de sentirse maestro, y un día y otro imprimió un nuevo signo en aquella dócil materia. ¡La indecisión de Feijoo encajaba tan fácilmente en la indecisión de Unamuno! El tema no fue escogido al azar. El campo era infinito. Unamuno filósofo, Unamuno novelista, Unamuno poeta, Kierkegaard y Unamuno, Unamuno y Heidegger y Sartre. Un autor digno de que alguien le consagrara la vida entera, y él, Fombona, encauzando esa vida, haciéndola una prolongación de la suya. Imaginaba a Feijoo en un mar de papeles y notas y pruebas de imprenta, libre de sus temores, de su horror a la creación. ¡Qué seguridad adquiriría! Cómo en adelante aquel querido muchacho temeroso podría enfrentarse a quien fuera, y hablar de todo a través de Unamuno. Y se vio a sí mismo, cuarenta años atrás, sufriendo avergonzado y solo por el verso que se negaba a salir, y que si salía era únicamente para producirle aquel rubor como fuego que nunca pudo explicarse. Pero de nuevo volvió la vieja duda a atormentarlo. Se preguntó otra vez si sus traducciones, monografías, prólogos y conferencias -que constituirían, en caso dado, una preciosa memoria de cuanto de valor se había escrito en el mundo- bastarían a compensarlo de la primavera que solo vio a través de otros y del verso que no se atrevió nunca a decir. La responsabilidad de un nuevo destino oprimía sus hombros. Y un como remordimiento, el viejo remordimiento de siempre, vino a intranquilizar sus noches: Feijoo, Feijoo, muchacho querido, escápate, escápate de mí, de Unamuno; quiero ayudarte a escapar. Cuando Marcel Bataillon nos visitó hace unos meses, Fombona les propuso organizar una reunión para agasajarlo y hablar de sus libros. En la pequeña fiesta Bataillon se interesó vivamente por los nuevos poetas, por la investigación literaria, por la pintura, por todo. Como a las diez y media Fombona tomó a Feijoo por el brazo (creyó percibir una ligera resistencia que fue vencida más por la autoridad de su mirada sonriente que por la fuerza), se acercó al distinguido visitante y pronunció despacio, con calma: -Maestro, quiero presentarle a Feijoo. Es especialista en Unamuno; prepara la edición crítica de sus Obras completas. Feijoo le estrechó la mano y dijo dos o tres palabras que casi no se oyeron, pero que significaban que sí, que mucho gusto, mientras Fombona saludaba de lejos a alguien, o buscaba un cerillo, o algo. FIN * El Daisie’s, en la calle de Versalles, cerca de Reforma."
